user_id,recipe_id,date,rating,review
12657,12395,2001-12-19,5,"Had this for dinner last night, and it was wonderful! The baingan (eggplant) bhartas that we get at restaurants are always terribly oily, but this one was very flavourful! I followed Mini's directions too... the tomatoes really added a lovely tang. Thanks! Also, I scaled it down to 2, but it serves 3 very generous portions if had along with rotis."
4272,4080,2001-01-02,1,It is like rubber.
10802,12253,2001-11-19,5,I DID eat all of it in one sitting!!
22278,12253,2001-12-13,5,I actually took your suggestion and had it with Jasmine rice.  It's pretty good and I love avocadoes.
6357,4112,2001-09-14,5,"Truly wonderful, feel like eating them all at one go:)"
15656,4151,2001-09-07,4,"These were real lemoney. Kinda too much for me but 
my kids and neighbor loved them. I give it a 4 star 
but Its a high 4 star :)"
7119,4199,2001-11-02,4,"Easy to make and also had a nice flavor, unlike other recipes this one actually had flavor. Very nice. Thank you for posting it."
16676,14520,2001-11-21,5,"to die for,,, the best ever.."
7802,11221,2001-09-04,4,These were a good change of pace from the usual tacos and burritos.
23179,11221,2001-11-26,0,"I can't wait to try this, I love Indian Tacos, I have made them before just throwing in ingrediants - the reason I am commenting is to tell you if you are in a hurry, you can fry some White Pita Bread and it tastes good also."
12069,8665,2001-07-12,5,Excellent meal that whips up in minutes!  I made it on a lunch hour.  You could add more vegetables if you desired to give it variety.
12392,8665,2001-07-13,4,this is good very close to my own recipe. i serve with crackling cornbread.
15501,8665,2001-08-21,1,Made this recipe and it was awful.
18128,8665,2001-09-04,4,"What do you do with the cooking oil? Saute the beef, which I did but it's not explained. could be awful
otherwise it's easy and good."
11989,8665,2001-09-26,5,"Everyone in my family and a couple of my neighbors tried and loved this beef stew.  I used dehydrated onion in place of the onion soup mix and soy sauce replaced the worchestershire.  I have never liked V8 Juice until I tried this recipe.  Just the right amount of veggie taste was added!!!

I procrastinated too long in the day and resorted to cooking on the stovetop which was about an hour and a half of simmering to tenderness."
10332,8665,2001-10-17,0,I can not believe this recipe made it to the top 10 list.  This was the worst beef stew I have ever had.  When I gave it a sample taste after work...I did not want to put it on the supper table!  It is awful!
27312,8665,2001-12-27,5,"Easy and quick to make on a stove top!  Just let it simmer til the veggies are done.  Great recipe for when there's not a lot of time to be messing around the kitchen.  The kids like my recipe for beef stew, but like this one better.  Get the beef stew chunks while they're on sale and it's inexpensive too!"
20713,12406,2001-10-07,5,"This was surprisingly elegant for such a simple recipe.  I was a bit worried about the vegetables getting dried out during cooking so I covered the pan during the first half hour.  The potatoes turned out just right - moist, tender and just a bit browned."
20497,12406,2001-12-13,5,My family absoultly loved this simpla dish. I made it with an low sodium Italian Dressing I found here on Recipezaar.. It was excellent. Although i did cut the Italian seasoning down due to the spices in the dressing. I would highly recommend this to anyone who needs a freshing idea.
4105,7303,2001-01-29,4,I would rate this one a five-star if the hot pepper flakes were omitted. I would omit the hot pepper flakes and use 3 cans of tomatoes and add 1 can of tomato and green chile's. Also for the next time I prepare the recipe I will devein and shell the shrimp then sprinkle cajun spice mix and let the shrimp marinate in it. If anyone attempts this recipe and uses 1/4 cup of the hot pepper flakes you will probably not be able to eat it if you cannot handle hot and spicy food. Believe me I am an amateur Cajun Chef and I could eat the dish but most people could not handle it. I will make this dish because it is rather quick and it is a one dish meal. I will however change it as stated in the beginning of this comment/rating.
6013,7303,2001-02-22,5,"My comments are for those who just read the review by the previous reviewer, Bill de Bruler who commented on the fact that 1/4 cup of hot pepper flakes was too much for this recipe. I'd have to agree but also point out that the recipe called for 1/4 teaspoon, rather than 1/4 cup. This might explain why he thought it was a tad toasty. I made it with the pinch of pepper and loved it. Thanks"
6244,7303,2001-03-07,5,From the editor: when Bill made this there was an error in the recipe that incorrectly listed the measurement of the pepper flakes. I have corrected this. Thanks.
9061,7303,2001-05-04,4,"I took Bill's suggestion and sprinkled my shrimp with Tony Chachere's Creole Seasoning Salt and let it sit while I prepared the rest of the dish.

I used Italian eggplant, and 3 cans of diced tomatoes with 1 can of tomato sauce, 2 Tablespoons of garlic.  I also modified the recipe to reduce the fat content.  Instead of using 2 tablespoons of oil to saute the eggplant, I sprayed a nonstick frying pan with Olive Oil PAM spray and was therefore able to tastefully reduce the fat content by more than 50% (sauteed the garlic in only 1 teaspoon of oil instead of 1 Tablespoon in nonstick frying pan as well).  Hooray for my waistline!"
17608,11087,2001-11-26,4,"My friend and I always go to Chinese bakeries when we travel and we always get ""Bean Muffins""  it was in honor of this that I attempted this recipe.  They didn't turn out quite right, which I will not blame on the recipe, but on the Sweet Bean Paste.  The dough is terrific."
9869,8505,2001-11-01,3,"Nice flavours, just a little bit sweet for me."
6357,14357,2001-11-16,5,"This cake is really yummy, I'd made it co-incidentally 3 days back:) Its quite similar to Chef Tebo's Easy dump cake and is really ""MMMMMMMMMMMMMMMMMMMMMMMMM""!!"
25933,14357,2001-12-11,5,"Wonderful! I however made a smaller version in a round pan using the ""Jiffy"" cake mix. Its just easier to have a plate for and there are no left overs (always keep wanting more you know)!"
9869,10958,2001-12-05,5,"Cheating? Who cares!!...it tastes good...lol
Didnt use the flour asked for, and it still tasted yum  =)"
8342,10958,2001-12-31,5,"My husband's favorite, just like his Mom makes!!!"
21694,13188,2001-10-28,5,"Very good, a must try."
21434,13188,2001-12-28,3,This was a very good dish....the rosemary and thyme made all the difference. This is a keeper.
27581,13188,2001-12-31,5,Thank you Dorothy for this crockpot recipe.....I only added a few things just to kick it up a little;>).....2 tsp ready to serve chopped garlic and 1 medium bay leaf also used Kosher salt....must say the best I have had!!!!
10216,4205,2001-10-23,5,I knew I'd got the idea for puting cream cheese in milk from somewhere...Makes a perfectly acceptable cheese sauce in a hurry...
9082,4225,2001-11-20,5,"This recipe is excellent, I make it almost every week"
6075,4176,2001-03-14,2,"This recipe didn't go over too well in my house. It makes a TON but my family thought it was too cheesy. Velveeta is a strong, sticky cheese anyways and when you use 2 lbs thats a lot. I think that if you added some spagetti sauce when you add the tomatoes it would help out a lot."
26689,11658,2001-12-25,5,Already made 2x this year to rave reviews. It's always a hit!
23394,5434,2001-11-20,4,"I like the proportions, but with a slight variation.  I cream the (softened) butter and sugar, then add the eggs, pumpkin, and milk.  Then the dry ingredients, doubling the cinnamon and adding a sprinkle of ginger as well.  Also, I have made the recipe as muffins, baking at 350 for approx. 20 minutes, to the great delight of my coworkers."
21752,11573,2001-11-12,5,"I didn't thing something so easy could be so good.  I added some hot pepper flakes and coarsely ground black pepper, and we were mopping this stuff up with pita bread after the chicken was finished."
15543,8402,2001-08-21,5,I tried this recipe yesterday for our American Legion picnic and it was a big hit. Everybody enjoyed it. I had some left over. It was very good. Thanks for having it on the site.
21694,4241,2001-10-22,4,"Very good, I will have to make it again around Christmas."
6357,11649,2001-09-16,5,"I loved it! Simple, easy and makes my heart and belly wanting for more:) You know, all these great recipes leave me wondering about how am I going to keep firm on my ground of not putting on those nasty kilograms:)!!"
1634,11649,2001-10-01,4,"I used long grain rice and let it simmer for only 15 minutes,in a pan with a tight cover, and then removed the still unopened pan from the heat, and let it sit for an additional 10 minutes.  In my opinion, the key to long grain rice that just tumbles on to the plate is making sure that every grain is coated with the oil."
21752,11649,2001-10-28,3,"I tried this the other night and it was good, although I cooked my rice using my idiot-proof microwave method instead.  My kids refused to touch it, though.  Their loss."
10216,13848,2001-11-19,5,"This I loved! just made it for lunch... unfortunatly my BF said it tasted ""strange""...I guess the combo of cilantro and tofy just didn't go down too well with him... he's more into steak and chips...shame, because I really enjoy experimenting with ""different"" things (diffferent to him that is, I love cilantro...and tofu). Refreshing and just a little bite from the cilantro and the onion. Nice textures from the rice and the tofu and just the right zing from the vineagrette"
2625,9241,2001-06-05,0,Just viewing the page reminds me how tasty it is!
2178,9241,2001-06-11,3,"Marinating in butter seems weird and not cooking the onions and garlic in the butter beforehand seems odd too. The salmon was good (of course), but I'm not sure the marinating added much to it."
10896,9241,2001-07-30,4,"I used this on fresh, fresh salmon from Seattle and my non-fish liking friends loved it."
11886,9555,2001-07-02,4,"this vegetable recipe is great, try adding some fresh rosemary sprinkled on the top, and it brings out a wonderful flavour. Yum"
14613,9555,2001-08-15,4,"This was very good, and the rosemary was a great touch."
10314,8698,2001-07-10,5,tasted great w/ lots of flavor.  We both loved it and I will make it again soon.  I would give it a try.
18395,8698,2001-09-06,5,"easy to make, tasted supurb, reccomended to ANYBODY!!"
18768,8698,2001-09-10,4,My first time cooking with a Curry Recipe that I liked!
9590,8698,2001-12-28,5,This one has become a staple in the family.  Love this easy and quick curry recipe...
9580,4110,2001-12-23,4,I am of Italian decent and am always looking for a new twist on serving pasta.  This recipe was delish!  My mother snickered as the sour cream was passed but proceded to clean her plate!  I highly reccomend this recipe.  As for the cheeses I used a combination of Gouda and Cheddar with a good measure of Bleu cheese for fun and flavor!  Go for it!
21694,4040,2001-11-12,4,Very good and refreshing.
20497,3993,2001-11-30,5,I made this recipe for my family last night. And they told me it was the best Salmon they had ever tasted. So I'm letting everyone know.. Make this for your family and they might just volunteer to do the dishes. Mine did. Thanks Helen.
13758,3988,2001-08-21,5,I omitted the peppers and it was still excellent.
20999,3980,2001-10-22,4,"We tend to like things that are spicy, so this was a little bland.  If I make it again, I will definitely add some more spices to the filling, since it's one of those recipes that can be adjusted to your taste.  Great thing to do with squash, though, especially since it's so inexpensive now."
6123,4776,2001-02-28,5,great!
12868,10263,2001-07-19,5,quick and easy to make tastes very nice
16140,10263,2001-09-06,4,Simply Delicious!
13736,10263,2001-10-12,3,Easy to make. Recipe did stipulate what to do with cinnamon and extra flour. Taste was ok.
8631,8470,2001-11-08,4,This was very tasty.  My husband inhaled it within 2 days.
13483,11853,2001-09-28,4,"Who thought up avo, banana, pineapple and cabbage?  And it works!!!  I let this ""marinade"" for a few hours and it turned out to be very tasty.  Will do this again.  Thanks for the recipe"
9869,14752,2001-12-25,5,"This was one of the appetisers we had for our Christmas dinner.
Very simple to make and very tasty, I didn't use as much cayenne pepper as the recipe called for, probably on 1/4 - 1/2 a tsp actually, but it still had a bite to it and everyone loved it."
15572,9495,2001-09-17,4,Very good light dinner with a green salad or cole slaw.
17721,9495,2001-10-05,5,"I changed the recipe and used 2 biscuits for
1 sandwich. I had a top and a bottom.Easier to
seal and you could fill it a little more.I then
ended up with 4 sandwichs. They were very good
and will have them again. They would be great
to have ready when friends come over."
21980,9223,2001-10-24,5,"Who would have thought eggplant & chicken together?    Very tasty meal, easy to make.   I added a little garlic to the browning of the chicken.    The  olive oil & white wine sauce gives it a fantastic taste."
26413,12762,2001-12-16,5,great recipie. simple but excellent
18660,3937,2001-09-18,5,This is the shrimp cocktail recipe I have been searching for. Thanks. It made a wonderful appetizer.
13429,8713,2001-07-30,0,"I make this same relish and I add 12 apples to mine...try it this way, its goood...."
6037,8534,2001-03-04,0,"I have not tried this recipe.  It sounds wonderful, but oh so high in caloried and fat!  Are you using whole milk ricotta?  And, can't a low-calorie marjorine be substituted but the butter??"
6358,8534,2001-03-12,5,"I just made this using nonfat ricotta cheese and light butter.  I also used Pam Olive oil spray instead of butter to ""butter"" the pan.  It was delicious and, I'm sure, considerably lower in calories and fat. Very easy to make as well."
8627,8534,2001-05-20,5,This dish is excellant!
10896,8534,2001-06-11,5,It is a guilty pleasure but I like to live it up everyonce in a awhile
12709,8534,2001-07-16,5,very good and my kids loved it!!!
12812,8534,2001-07-23,5,"EXCELLENT, MY HUSBAND AND TWIN DAUGHTER''S GET FRESH ASPARAGUS BY THE POUND''S IN THE EARLY SPRING BY JUST WALKING ALONG COUNRTY ROAD''S..IT''S OUT THERE AND WE LOVE IT. I AM ALWAY''S LOOKING FOR NEW WAY''S TO PREPARE IT.. THIS IS VERY GOOD. IF YOU LOVE ASPARAGUS, YOU''LL LOVE THIS RECIPE....."
19241,8534,2001-09-16,5,"This dish is excellent. I have made it twice now and the second time I didn't have any ricotta cheese, so I used cottage cheese which was also good."
10314,8534,2001-10-01,5,This was great!!!Probably the best recipe from this site. I will make it again soon.  Try it !!!!
18450,8534,2001-10-03,5,"I expanded the recipe a little to feed a larger group and put sauteed chicken breast as the bottom layer. It could have used a tiny bit of chicken stock in the expanded recipe, but was an absolute success. Very well recived - thank you!"
18391,8534,2001-10-06,5,"My husband loved it, thanks!!"
21694,8534,2001-10-28,5,This is a great easy recipe.
11000,9412,2001-06-14,0,Very tasty and authentic.
5012,780,2001-01-16,4,Very good but not a 5 star
6199,3928,2001-03-02,1,"Something is missing.  Followed to recipe and it was too runny and tasteless.   Tried to dress it up, but was unable to find that great Pappadeaux flavor.  Help..."
19345,3846,2001-10-03,5,"Wow!! I have tried to make white gravy a few times, but could never get it right. Now, I finally did!! Thankyou so much! :-)"
20828,3846,2001-12-14,4,"Good stuff!!  But I added a scant tsp of ground summer savory and 2-3 Tsp chopped onions to the pan 2-3 minutes before adding the flour to the pan.  Also, I taste the gravy and if it lacks flavor, I add a cube of chicken or beef boullion.  Really love GOOD gravy.  

Warren Holmgreen"
5503,3844,2001-02-01,0,Sounds a bit like Bigos
15814,6567,2001-08-30,1,Unclear as to what to do with the apples ect.
16140,10837,2001-09-25,4,Lovely fresh tasting sauce.
9869,13467,2001-11-19,5,"Used oil to brown the chicken, then butter instead of margarine for the honey mix, loved the flavour and the crunch.  =)"
9869,7806,2001-08-21,3,"Must admit, was a little concerned when I put this in the oven...but was actually quite nice."
21013,10737,2001-10-11,1,I just can't believe how much fat is in this recipe. yuck!!!
6164,8599,2001-08-06,4,"Turned out really nice ! Keep up the gooooooood work of creating copycat recipes. Infact liked your candidness about the same.
Smiles
mini"
7920,4330,2001-04-09,5,I have made this recipe several times.And my family just love it.It's easy and made a great dish for Thanksgiving.A lot of people have said for the recipes.My children also liked it.
10320,4330,2001-05-29,5,"I made the recipe for Memorial Day and my family absolutely loved it. I made a few enhancements too please my son,(topped with mini marshmellows, and sugar/cinnamon). It's absolutley a delightful alternative to our traditional candied yams. We really tip our hats off to the chef for this one!!!"
5988,4330,2001-06-04,5,We have had this casserole several times at our church functions and it always goes over big.
18424,4330,2001-10-04,4,It was wonderful and simple to prepare with items on hand.  Using canned sweet potaotes it was a snap to fix.
24388,4330,2001-11-21,5,was a hit at thanksgiving dinner at work and so east to make
26457,4330,2001-12-17,5,Really easy to make and delicious!  Don't skimp on the topping!  Thats what makes is special!
19799,4330,2001-12-29,4,This was good stuff.But next time I will leave out the nuts.
6563,4423,2001-03-29,4,"I LOVE this recipe!  My family always added sugar to make it a little sweeter, and my in-laws put crumbled Ritz crackers on top. Either way, this dish is always there when the family has a big dinner."
11811,4423,2001-07-05,5,"My 5 year old made this almost completely by herself and it turned out fantastic!!! Everyone loved it and because she made it herself, my veggie shy daughter ate 3 helpings!!"
15734,4355,2001-08-24,0,"I haven't yet tried this recipe,but a comment on all of the sausage recipes I've seen on Recipezaar. There are several which call for fennel,but none for anise. Try subing anise for fennel."
6357,10533,2001-08-01,3,Its a nice one except for the ladyfingers.
9121,10519,2001-08-23,0,I wonder what one could substitute for the honey to make this vegan. Maybe I'll use brown rice syrup and let you know how it turns out.
22397,8814,2001-10-30,4,"Liked this recipe.  Be sure to buy raw shrimp, not precooked as they will be overdone.  Would use a bit more chicken broth to ensure the sauce stock is ample.  Great job."
4470,4508,2001-06-25,4,Good recipe I'll certainly make this dish again Thanks
18318,4539,2001-09-06,0,"I baked this pie in a graham cracker pie crust and it browned nicely, but when served it was a mushy mess.  Don't know what I did wrong."
4891,7393,2001-01-16,5,"When I was a boy in the 1930s my brother and I would catch bull frogs and father would dispatch and prepare them, we also picked wild button and shaggy main mushrooms, cleaned all and fried in butter, served on toast and devoured."
4470,4544,2001-08-08,4,I do this same recipe without the baking powder.  Tony Chachere's more spice is super.
14325,4687,2001-09-23,5,any icecream that children can do is wonderful. and the pudding gives a good creamy taste.
9007,4667,2001-05-02,4,Verry Yummy! My 9 y/o had 7 pieces!
20160,4662,2001-12-23,4,These were good - I added some feta cheese and red pepper.  Yummy
13562,9198,2001-09-10,5,This bread is easy and delicious!
5060,12493,2001-12-10,5,"Very good marinade!! I marinated flank steak overnight in it, stuffed it, and used the marinade poured over it to bake it, I added smashed garlic 3 cloves, a dash each of cayenne, corriander and cummin.  Thanks Eve for a good one!!"
27115,15240,2001-12-25,3,"To make this a 4 or 5 star recipe, replace the nutmeg witha tea to tablespoon (depending on preference) of mild english mustard.
The dish will obviously become more savoury and be an absolute delight to have as a side dish with any meat dish. Yummmmy !!"
18995,7849,2001-09-19,5,I really liked this! I used frozen diced and cooked chicken and it made the recipe really simple to make.
21434,4807,2001-12-28,5,"I used CHICKEN instead of turkey, and it was very, very, good.  The skin was evenly browned,the meat was juicy, tender and flavorful. I stuffed the cavity with fresh rosemary, thyme and onions."
4395,4829,2001-01-10,1,I believe there is a mistake in the amount of eggnog listed in this recipe...5 1/2 cups is too much and the batter overflows a 9x5
9121,4854,2001-05-17,1,Not very good.  Not much flavor.
15041,4854,2001-08-15,5,Wonderfully light texture.  Delicious
14059,10756,2001-09-10,4,A classic.
18660,12436,2001-10-29,5,This made a wonderful side dish. I used almonds instead of hazlenuts and the recipe was delicious. I served this with another Recipezaar recipe called Roasted Sticky Chicken. I plan on making this again!
5929,4903,2001-04-09,5,"This is terrific, I also added about 1 tsp. of poultry seasoning.
Family loves this."
15609,4903,2001-09-23,4,"Very Good.  Instead of the chicken broth though, I'd boil the turkey carcass for really rich turkey broth."
11295,14645,2001-11-21,5,"oh, I made this today...and it delicious!"
26301,14645,2001-12-16,5,"I have made this recipie twice and recieved praises both times. 
 I will make it a regular meal in my family!"
15385,13586,2001-11-13,5,"Thank you so much for that wonderfull recipe, it is more than good"
6357,8717,2001-05-24,0,"The colour green makes your hunger pangs grow more n more by the minute!!
Too tasty to resist!"
25656,13146,2001-12-08,5,"i really enjoy this meal. the texture is perfect, and it can stand in the pan if youv,e forgotten to toast yer bread. it is the only way i like eggs."
7802,64327,2001-11-26,5,"Quick and easy to make; a very good, basic pecan pie. This was the first time I made my own, and it came out great."
13819,10708,2001-08-10,0,"This is the GREATEST Crab recipe I have ever tried!!!!

All my friends loved it!!!"
9869,9286,2001-08-15,5,"Made this with the lime juice and ginger..wrapped it in tin foil and let marinade for an hour or so, then put on the barbecue for 12 minutes, it was really delicious.  =)"
16140,11472,2001-09-25,4,"This was really good,as a variation I substituted blue cheese for the parmesan,also tasty."
19799,5016,2001-12-29,5,Totally yummy!!One of my family's favorite.This is much better than what you get in restaurants.Plenty of crab with really good flavor.We eat them with sweet and sour sauce.
14059,11478,2001-09-10,4,"Very good. Works with skin-on catfish fillets, too..."
23139,8813,2001-11-26,5,"This was Delicious! HOT & SPICY! A friend's family
has a secret cajun shrimp recipe and I always wanted
to be able to make my own. This recipe is actually better than theirs! :) It was very easy to make and the french bread was good dipped in the sauce around the shrimp and to soothe the burning mouth. I will use this recipe over and over im sure!"
10958,5090,2001-06-12,4,"I thoght it was good, but not great"
5607,4395,2001-02-04,0,This would be better with real bacon
5581,4395,2001-02-04,4,I havent tried this but it has everything in it that I like. Im going to try it tommorrow after I go shopping.
5751,4395,2001-02-12,5,"Kraft used to have this on the market. This recepie is just as good, if not better."
6660,4395,2001-08-23,4,This was every bit as good as Heluva Good prepared dip.
22015,4395,2001-11-09,4,I had a store bought version of this dip years ago and haven't been able to find it since.  I was so pleased to see this recipe.  I tried it tonight and the family loved it.  Thanks for submitting this recipe.
27603,4395,2001-12-31,5,My family has loved this recipes for years!
15945,5146,2001-08-29,4,"It is a very simple dish to make and produce incredible result. Execellent taste and colour.

I would like to add my two cents worth... for those with a bit of time... add fresh mushrooms, lots of onions, garlic and goes great with roast potatoes. Time with 4"" deep dish... 1 hour. Be liberal with the white wine.

great stuff"
12782,5146,2001-09-06,4,"This was absolutely wonderful!  I work full time and go to night school and this was a perfect meal for my husband, and still warm when I got home from class!  If you are making it in a crock pot, you need to double the recipe or it will cook faster. (unless you have a small crock pot)"
18453,5146,2001-09-07,5,"This is a wonderful recipe.  I used boneless chicken breasts cut in strips, served over egg noodles. The mixture of wine and sour cream gave it a savory taste.  AND easy to make, just threw it all in the crockpot!"
18651,5146,2001-09-10,1,creamy ingredients and spices need to be added toward the end of cooking time.
13483,5146,2001-11-15,4,I did this in a crock pot with one cut up chicken and extra breasts.  It cooked quite quickly and was delicious.  I found the sauce was too thin so I simply added some cornstarch mixed with water and soy sauce to thicken.  Loved all the sauce.
21618,11049,2001-10-20,1,Not Impressive
13593,13269,2001-11-12,5,This is a delicious recipe.  The roast is tasty and it makes wonderful gravy for mashed potatoes. Definately a keeper.  Thank you for sharing.
18551,13269,2001-11-20,4,"I made this recipe yesterday and it was very good.  However, I thought there was an excess amount of 'liquid' for making the gravy.  I think next time I would use only one-half the can of Pepsi.  Thanks for sharing!"
