user_id,recipe_id,date,rating,review
10896,9993,2001-07-06,4,"This is excellant, really good with tuna or salmon steaks."
4470,9993,2001-08-06,4,I served this recipe with BBQ Fish fillets and everyone loved it! I used Angle Hair pasta.
13483,4682,2001-09-26,4,I am not a fish eater (love shell fish though). I did this for some people who wanted salmon grilled.  They were dutifully impressed and claimed it suited them just fine.  Based on their opinion I rated it 4 stars!
27257,11055,2001-12-27,5,Easy to make and very delicious!! I can really recommend this recipe for a cold day.  Served with vanilla ice cream it is a winner!!!!!!!!
5060,12042,2001-10-08,4,"Love the caraway, very good cabbage but we felt it needed salt and pepper, added it at the table.
Just happened to be snipping chives from the garden to freeze them, so I added a couple of tablespoons of them to the cabbage, I think it added to the taste. We enjoyed it and will use the recipe again.  Thanks Bergy!!"
19060,11753,2001-11-25,5,"Outstanding!  I was searching for a ""cozy"" soup and this was it.  Thanx for sharing such a great soup."
14386,13367,2001-12-04,5,This is one of my favorites! A great cake for chocolate lovers. Warm and delicious.
26271,13367,2001-12-15,1,This was definitely a horrid cake.  The water called for was too much and the taste was bland and unsatisfying.  Please do not try this one.
24784,8123,2001-11-27,5,this recipe was extemely easy to make. It only took me about 10 minutes to mix everything up and then i put it in the oven to cook. I made this cheescake for spanish food day at my school and everyone liked it! It was gone in just about 5 minutes..
26518,15869,2001-12-18,5,I'm so happy to have this recipe and thankyou for sharing it!
15135,8098,2001-08-15,4,I find that using sliced or cubed beff works much better that ground.  All and all this is a very good recipe.
22212,115,2001-10-28,5,"The white wine (I used an inexpensive local wine put out by Bully Hill Vineyards) and the flavor of the clams fused together and complemented the whole dish. This dish was very easy to make, and the whole family enjoyed it."
13483,11913,2001-09-28,5,This is good and beyond easy.  I swirled some chocolate sauce over the top for decoration and another taste dimention.  It was a little runny so next time I will put it in the freezer a half hour before serving.  Excellent simple and good recipe.  Thank you.
8897,8830,2001-06-05,0,"I cook a lot of fish, mostly salmon and lake trout, but this recipe has too much fat for me as I am low-fat cook and avoid sat fat as much as possible.  You often have recipes that I could use.  I do enjoy the weekly newsletter.Colleen"
21752,3208,2001-11-25,4,"I actually preferred this hot, it's perfect for a cold winter's night.  If you have a cold add some more ginger."
10404,10122,2001-09-10,5,I made this last night using veg stock (for my vegetarian daughter) and we all loved it.  I've never had cukes in soup like this.  Thanks for posting.  Di ;-)
6234,3812,2001-03-04,0,This is a great recipe! Try serving with hollandaise sauce.
25021,7229,2001-12-10,4,"My family likes this one real well. I added  mild 
cheddar cheese to the top of each pepper."
21694,12918,2001-10-20,5,Absolutly delicious.  I served it with some pasta.
9441,1442,2001-05-16,5,"YUMMM!  Growing up in a Dutch family in Mid-Michigan (yes, I also have family in Holland, MI), this recipe brings back memories of my childhood!  Thanks for reminding me how good they are!"
23302,15343,2001-12-10,5,"Excellent recipe. For personal taste, I crumbled Feta cheese into the dressing and, for a change of pace, served it over whole wheat pasta. I found the Italian seasoning to be a smidgen strong, so next time I will reduce it just a little."
4411,607,2001-01-08,5,"Aren't there 6 or seven stars to choose from.  WOW!  I was so excited to see this recipe.  I absolutely loved this soup when my husband and I would go to Famous Barr 30 years, when he was in the seminary at Concordia St. Louis.  I have made it through the years, because an aunt had sent me the recipe from her local Springfield, IL newspaper about 20 years.  Once I lost it, but a friend retrieved it for me from the time she had asked me for it.  What I love about your site is the instant way to double or triple or whatever the recipe!  I make this recipe a number of times each year, but I always make it for a big Christmas Party we have.  Everyone loves it and looks forward to it each year!  Thanks so much!  I always serve it with homemade bread and a Ceasar Salad.  I look forward to your newsletters."
13017,607,2001-07-23,5,"It is the most delicious onion soup I have even eaten, and when I lived in St. Louis I would eat it at least twice a week, especially on Friday."
18207,4753,2001-09-18,4,This recipe is very easy and very delicious. I found it to  be rich and filling. I made as a side with ribs.
19639,12083,2001-10-01,5,The title of this fondue is amusing.  A lovely fondue with surprising flavours.  The name of this fondue should be changed to The Great White North Fondue as its primary ingredient is Canadian sharp cheddar.  Remember to use a Canadian beer in the recipe as well.  Give yourself and your guests a treat.  Then again I may be wrong in assuming the name of the fondue is not appropriate.  A good disguise...cheers to the canucks!
10216,12083,2001-10-22,5,"I LLLOOOOOVEEE fondue! need garlic lots of garlic...can't have a fondue without garlic!!! (vampires beware!)... Well, now I think about it I dont want garlic in my chocolate fondue... I'll have to dig up the recipe and post it :)"
26684,16005,2001-12-20,0,"Delicious, especially warm from the oven.  Should be good with a pineapple smoothie,"
8221,8727,2001-04-13,4,"My friend  did this salad for me at a dinner she had.  It was so fabulous I had to ask her for 
recipe.  I made it again a few days later, and the family loved it.  I lost the recipe at home
and thanks to the net, I have it again! Definately a must do salad!  I served it at the end
of the meal.  It was like serving a 'salad' and 'dessert' in one dish! If you do do this recipe,
do add the shaved cheese. It's amazing!"
14257,9145,2001-08-10,5,"I've been looking for the perfect salsa recipe and feel like this is it.  Maybe it's the lime's (as Bonstr says) or the fresh Missouri Roma tomatoes....either way, this salsa is great.  Try it.

McCool

PS:  I add a little cilantro (just personal taste)!"
20832,9145,2001-10-09,5,"Oh.... my.. GAWD.... This is SALSA NIRVANA!!! I've never tasted anything like this in my life. I made it for a party, and people were practically tackling each other to get to it! I had to make another batch! Not super hot, but you could ""kick it up a notch"" with more jalapeno if you wanted, I suppose. VERY tart and citrus-laced. Lots of body, color, and visual appeal. Try it on burgers, chili, almost anything!!!

Bonstr, whoever you are, BOTTLE THIS STUFF!!! You'll be rich."
5981,9145,2001-11-12,5,"Holy cow!  This salsa is defintely ""Awesome"".  Never mind the chips...I could eat this with a spoon!  Yum"
15572,11886,2001-12-03,3,"I served it over angel hair pasta, and it was a little dry.  Next time, I think I will add a splach of red wine to make it more moist.  It was tasty though."
4470,12204,2001-10-01,5,"Thankyou Dorothy, I made this dish for brunch today and it looked great and tasted as good! I cut the recipe in half but left the Jalapeno & Garlic as called for. When I opened the fridge I saw ther were some bits and pieces of red, yellow and orange sweet peppers so added them as well. Excellent.  I'll be repeating this dish.  You can do ahead and just pop in the oven before brunch."
20629,12473,2001-10-31,0,good s#!t!
6357,15078,2001-12-04,5,"This is a real simple easy fudge. I''ve tried it before and its been a hit with all, especially the kids love it. Very simple and tasty!"
12892,7195,2001-07-19,4,"This is a great recipe!  You can also dredge the ""scotch eggs"" through egg and flour and then roll them in bread crumbs.  You can also fry them this way or bake them at around 450 for a healthier version."
26142,3572,2001-12-14,5,"Thanks, Great Recipe.  We all love it
Chrissy Cope
"
12246,10729,2001-08-15,5,"I didn''t have pecans so I used walnuts. I used chocolate pudding and topped the cool whip with more walnuts. The recipe didn''t say what size container of cool whip, so I used the 12 oz size and the recipe was to die for."
27323,10729,2001-12-28,5,fantastic!! I''ve made it with the several different flavors of pudding.. they all taste great!
12875,10729,2001-12-29,5,I have this recipe only it is called 7 layer dessert.  I use 1 box of chocolate and one box of butterscotch pudding and they make 2 separate layers.  This is delicious.
4524,4561,2001-01-16,4,wasn't that bad ??????? why do the always make the chicken so big in the market place.
13483,11284,2001-09-04,5,I love simple and easy.  This was prepared in the early am and cooked in the pm.  Great stuff
22278,11284,2001-10-30,4,"Pretty and tasty.  I added broccoli for color and salsa so it wouldn't be dry and jalepenos for spice.  I also used soy cheese instead of dairy cheese.  Yummy,"
12657,11284,2001-11-21,5,"Loved this one too, Bergy! I was afraid it would be rather bland, but it turned out wonderfully. I'd also like to try this with broccoli instead of cauliflower, though the crisp baked cauliflower was very, very yum! I had this with freshly toasted bread for an absolutely delightful dinner :-)"
16140,12560,2001-10-28,4,"Very nice,real  comfort food,I did add some garlic though and served it with Jacket potatoes."
4242,992,2001-01-02,5,"my family loved these.  fresher than any boughten poppers.  take some preparation time, but are well worth it."
23293,12554,2001-11-10,5,"this recipe is mouth watering  loved every bite

    served it with white wine."
20832,9110,2001-10-09,5,"Oh, what a great idea! phyllo dough and ground beef! I tried it with the cinnamon and stuff, and it tasted very Greek, like a pasticcio. I made another one without those 2 sweet spices, and it was more Italian. You can make a huge variation in the taste just by varying the spice mix a little bit.

Yummy! I think I'm gonna gain weight, but oh well, food is love.

Please, post more recipes!!!"
20754,12859,2001-11-23,4,These cookies are great but I did add about 1/2 cup of extra flour to make the dough a little more managable.
10263,9220,2001-06-25,5,"Eve has cooked this one for me many times...its the best...so tasty, goes well with other meat dishes or even as a light dinner dish on its own...YUMMMMMM"
21618,12801,2001-10-20,1,Not Impressive
27503,11627,2001-12-31,5,I actually have this recipe in a cookbook of mine and it's delicious!!! I'm a novice in the kitchen and it was quite easy to make. I did however use a slightly larger pan so I made more of the first chocolate mix and it turned out great. A simple desert that will knock the socks off your guests.
18977,9063,2001-09-23,5,Exceptional flavor!
13483,902,2001-08-16,3,Very easy to make for a lunch.  I served it cold as a sandwich.  I found it a little too bland though.  Next time I make it I will add some cheese (like blue cheese or sharp cheddar)
10649,902,2001-12-05,2,"I agree with a little bit bland. I will try the cheese next time.
Keep Cooking Everyone!"
9672,15688,2001-12-25,4,"Great recipe, Thanks.

Easy to make and fun to eat. 

Made it for a Christmas office party and had many requests for the recipe.

The name is fun too"
20371,15688,2001-12-25,5,"This was a big hit at our family get-together on xmas eve, with both kids and adults. I had 2 people ask for the recipe! It was easy to make, and tasty too; all I would suggest is making sure you use 2 cookie sheets to spread the mixture out on. I used one and it was a bit of a pain breaking the mixture up after it had hardened since it was pretty thick."
21641,13064,2001-11-12,4,"Easy to fix, and really good. My daughters kindergarden class loved it."
6357,15426,2001-12-20,5,"EXCELLENT! I added 2 cups milk, 9 tsp butter and 10 tsp. sugar to this and it is delicious!!!"
8631,2267,2001-07-19,4,"Pretty tasty.  Although, I found it on the sweet side.  I would suggest reducing the icing sugar to a 1 1/2 cups or even a cup depending on the sweetness you prefer."
25777,14337,2001-12-10,5,"These were the most popular appetizer at Thanksgiving!  We were having some vegetarians at our Thanksgiving feast, so I made an extra batch of the cranberry sauce and put in the vegetarian (soy) meatballs from Trader Joe's, and that way everyone was happy!"
2312,14337,2001-12-26,5,"YUM. These were a big hit for our Christmas gathering (so festive!).  Used fresh cranberry sauce, and less catsup than was called for (because I didn't have enough) but it worked out fine.  Only thing was I didn't realize it called for a crockpot, so I just put it in the oven on low for 20 minutes (until we couldn't wait any longer).  They would definately benefit from a slow sit in the sauce though.  Thank goodness I got a crockpot for Christmas!!!!"
24122,14337,2001-12-28,5,"We really enjoyed this recipe.  the sauce has a sweeter taste different than a tomato based recipe, but that was what I was looking for.  Excellent flavor and easy to make.  I made the meatballs and cooked them the day before.  Then, when they cooled, I put them in a baggie in the fridge until the next day.  They were wonderful and the leftovers reheated  well in the microwave.  In fact, they just keep getting tastier!"
27452,14337,2001-12-31,5,My family really enjoyed these meatballs.  I did make a mistake because I cut the recipe in half thinking that I would have made too many.  Silly me next time I won't make the same mistake..
11449,6561,2001-06-19,5,"AAAAAAAAAAHHHHHHH, son!  Man, is dem sum gud mudbugs!!!    MMMMMMM  cant wait to git me sum mo!"
25690,10117,2001-12-25,5,"EVERYONE LOVES THESE COOKIES!  I recommend using butter instead of margarine for better tasting cookies, and my oven took 12 minutes to make them golden and perfect. I couldn't believe how fast these cookies were eaten!!  They are great!!"
21752,11336,2001-11-05,4,This is a good recipe if you have a bored 10 year old in the house.  My daughter invited several thousand of her closest friends over (at least that was the noise level) and they could handle this recipe all by themselves.  Even the dog joined in (cleaning up dropped dough).
13483,617,2001-09-20,4,Did this for a desert and coffee night.  Made them a week ahead and put them in the freezer.  Tasted as though they just came out of the freezer.  Will do these again.  Thanks
26313,14928,2001-12-16,5,"very, very good! :)"
12782,693,2001-08-30,4,This recipe is good for a quick meal.  Be careful not to add more milk than it calls for!
13483,693,2001-09-23,4,"What a simple ""souper"" (no pun indended) dish.  I served this over rice with beans and cream corn on the side. Not an eligant dish but what a winner as an every day fast and easy dish.  It has may way to vary it.  I'll do it often"
16854,11277,2001-09-20,0,"When I fry corn, I use silver queen, also I use milk and butter instead of a can of cream corn and it takes longer than 10 minutes to cook"
19043,11277,2001-10-01,5,"This was really very good.  I liked the creamed corn.  I added some red peppers as well, it was a pretty dish."
15609,11277,2001-10-01,5,"This is very good.  Mom always used cream instead of the creamed corn.  I use the cream corn.  I think you get more of a ""Corn"" flavor.  This is kinda related to my corn casserole.  A distant cousin maybe but related."
12021,3632,2001-07-02,4,the family loves it.
23746,14130,2001-11-15,4,"I LOVED this recipe, and the only reason I took away one star was the fact that it was a bit bland in the taste. A great, healthy means of eating for breakfast and I love eating this before a big sports event or game, since I don't like the fat content in foods. To give it a bit more flavor, I suggest adding Cinnamin to the batter, it adds a lot of flavor."
6357,14130,2001-12-10,5,"WOW! These are addictive! I used 1/4 ltr. of Fresh milk instead of skim milk and 2 large ripe bananas instead of 2 small ripe ones. I mashed the bananas first and then added that to the sugar-flour mixture. It took me nearly 30 minutes to make these, but it was well worth the effort, because 1000% these are ""yum""!! We enjoyed it with evening tea. Great recipe you got here:)!!"
12657,14130,2001-12-28,0,Substituting whole-wheat flour with cornmeal is a wonderful variation to the recipe! Had them for breakfast yesterday... yum :)
27454,16337,2001-12-31,4,Watch out ..Ben is not that gentle :)
13797,1420,2001-08-05,5,"I've been making a variation of this recipe for 20 years and most prople say it is better than ""Grandma usta make."" Secret to fluffy buscuits is not to underwork the dough."
14241,1420,2001-08-10,0,What is the recipe for the amish starter mix for the Amish biscuits.
9725,2498,2001-10-29,5,"i served this to my card club this month, they all loved it and asked for the recipe. i give it a 5 star rating"
23132,2498,2001-11-15,5,this is VERY easy and oh so YUMMY!!!!! a family favorite!!!!!
26366,2498,2001-12-16,5,"An outstanding easy, delicious recipe that everyone loves!!!  I have taken this to several parties and it is loved by everyone.  It is a must that you bake it in a 9 x 13 pan and serve with whip cream"
17608,14103,2001-11-23,0,"Another adaptationthat I learned from my MIL is this:  Instead of cinnamon schnapps, use peppermint.  Add 1 scoop of vanilla ice cream to each mug.  Now, you have a Hot Alpine!"
23607,13744,2001-11-14,5,"I've used this recipe for several years, it is a favorite of my guests and a great alternative to the too sweet standard sweet potato casseroles.  I"
2312,13744,2001-12-08,4,"This tasted great, but it didn't ""look"" as I expected it to.  I guess I would have liked a bit more liquid or something to help everything ""mush"" together.  Perhaps I just cooked it too long...  Still it was a great Thanksgiving sweet potato dish."
26999,12309,2001-12-25,5,"This is an awesome recipe!!!  I would prefer these turtles over Fannie May, any day!  It is a bit time consuming, but the results are fantastic."
21107,12747,2001-10-22,0,"I made this cake to take to a buffet supper. Everyone loved it and I got many compliments. It 
cuts beautifully and the lemon gives it a light taste and the poppy seeds add texture."
17293,9753,2001-08-31,5,"Delicious, but one must make sure to cook all the different ingriedients slowly to allow the tastes to explode in your final dish."
6357,12716,2001-11-16,5,"Excellent, we make this at home but use cilantro instead of parsley and water instead of vegetable stock. I love brown rice alot and mom insists on carrots, so it's a great combination!"
26979,14999,2001-12-23,5,"Yes, this is a very easy recipe, but it's also very tasty.  

The squares of fudge were beautiful in little foil cups on my Christmas treat platters. The contrast of the white fudge with chunks of red and green were so ""Christmas-y"". -- a definite crowd pleaser."
21487,9713,2001-11-27,5,"Ditto on the tabasco, I too like my dishes hot & spicy. This is so easy and so tasty...THANK YOU!"
12129,9713,2001-07-27,5,This was fabulous!  I would add some tabasco sauce though because it wasn't quite spicy enough for my tastes.  The cream cheese really mellows out the spice.  Very yummy!  The kids in my house were licking the bowl.
19810,9713,2001-09-25,5,"Oh yea, this is yummy!"
19091,9713,2001-10-09,5,This is awesome! I just microwaved it. It was so easy. Love it!
14433,9713,2001-10-20,5,"So easy. Along with the great taste, makes this recipe a Super Star."
22475,9713,2001-11-01,5,"Excellent!  This one was quite a hit for our ""dip as you can"" dinner on Halloween night while we served candy to the goblins at the front door.

My one comment on this area of recipezaar in general...WHERE ARE THE LOW CARB FOODS?  None of these are low carb so far, though if you left off the chips on this one, it might come close.  However, it'd be too rich to handle."
18977,7219,2001-10-15,5,"Sounds great!  But...do you use fresh, raw or cooked asparagus or do you use canned?
Is there no liquid required in the veggie soup mixture?"
11291,3628,2001-06-26,5,"Extremely tasty recipe. I did rabbit before and was very unsatisfied thinking that rabbitmeat is just not tender. But no, not when it has been soaked in tasty redwine overnight. Try it! You'll love it!"
21471,3628,2001-10-17,5,This was the first time i have had rabbit and it was amazing.  The prunes were a nice touch and the recipe was fairly easy.  Rabbits Rule!
8511,4978,2001-04-19,2,This dish might have tasted better by either replacing the tuna with a white fish or by adding olives or something. It was also a bit to bold tasting for me.
4445,4978,2001-04-26,4,This recipe is good with either white fish or tuna.  My sicillian husband found it a little bland so I substituted roasted red peppers for bell peppers.
14422,4978,2001-08-21,3,"Doubled quatity of elbo macaroni to mre casseole-like.  With the tuna, it's a challenge to keep it moist."
4470,10011,2001-07-31,5,"Excellent,  slightly different salad. I used 1/4 cup of sweet onion instead of the spring onion.  It went well with cold chicken. Thanks"
14613,10011,2001-10-10,2,not all that impressed with this one.  the parsley didn't compliment the combo of flavors at all.  i only ate a bit before throwing the rest out.
8728,2774,2001-07-19,2,The bread is tasteless.
10260,2774,2001-07-24,0,"Haven't tried this yet, but wanted to comment to Ashley that Navajo Fry Bread is meant to be topped with powdered sugar or honey, or used for the delectable ""Navajo Taco"" (top with refried beans, lettuce, tomato and shredded cheese)."
26692,14200,2001-12-31,4,"This was an easy recipe to make and was very tasty.  You may need to tweek the seasonings to your taste, though."
13504,11067,2001-08-29,4,Very Good!  This is an easy recipe and perfect as a colorful Holiday gift.  Thanks so much for the recipe!
17608,12808,2001-11-05,5,"This is really a great cake!  Sometimes you need a break from the norm, this will do just fine.  Quick, easy, very tasty."
13063,15228,2001-12-23,0,"I just made these again this morning, adding in two chopped-up apples.  Yum!  They had to bake a wee bit longer, but were so moist and incredibly good!"
26066,15059,2001-12-13,5,"This is an excellent cookie recipe.  Great for gift giving also.  I have made this for a couple of
years...only difference is that I don't sprinkle peanuts on the cookies just in case
of food allergies that someone may have."
19895,2387,2001-09-26,5,Yum cool tastes just right
9869,2387,2001-10-25,5,"First time I have ever tried this pie, have always loved Lemon Meringue pie...so figured Id give this a go. GREAT decision!"
25757,10045,2001-12-10,4,"Excellent flavor (just sweet enough to let you know its there). Once cooled filling spreads evenly, Very easy to make, a PERFECT filling for your layer cake it was a tremendous hit!!!! Many thanks to you for posting. 
THANKS,
      Steve"
12200,10159,2001-07-13,0,This cake is the moistest cake I have ever tryed.  What a wonderful way to eat zucchini.
12307,3597,2001-07-09,5,"Excellent cake! But pay attention to the ingredient list. My husband read the ingredient as pudding and we baked it first time out with pudding. The cake flopped. Second time, we baked with a yellow cake mix with pudding included, and the cake turned out fabulous!!"
15609,12115,2001-10-02,5,"Very Good.  I used fresh tomatoes though since I have so many.  And fresh basil.  Other than that, I followed this recipe."
25366,12115,2001-12-04,5,My 11 year old made this as a math project.  He used all ingredients and exact measurements.  It is wonderful.  Easy to make.  Worth the extra time.
21694,502,2001-10-28,5,"Absolutly wonderful, a must try."
21694,13572,2001-11-03,5,"This was absolutly wonderful, but I used fresh beans instead of frozen."
15385,10752,2001-11-25,5,"very good and tasty......a simple dish that gives satisfaction
thank you"
6357,9701,2001-09-06,0,"A favourite with those from Mumbai, India including me!"
9121,15348,2001-12-10,5,These hit the spot.  I added cashew pieces to a few of these and they turned out nicely as well.
23836,15348,2001-12-16,4,a real flavor delight  but a bit involved ... would be a good one to make with my nephews.
1634,12484,2001-10-08,0,"I like to wait to add the cheese until after the eggs have been poured into the hot pan, and have begun to set. This offers the eater a flavor burst with every bite and when making omlelettes for several people, the amount of cheese can be adjusted to individual taste."
22099,12021,2001-10-28,5,Yummy! Very easy to make and no cracks in the cheesecake. I used cinnamon graham crackers instead of the cookies. I''m going to make this for Thanksgiving.
25267,9471,2001-12-04,4,Great tasting. I replaced the sauce with a spicey chille sauce.
6755,7224,2001-04-22,4,This is a tasty use for eggplant that's easy to prepare and healthy to eat.
6512,7224,2001-11-08,4,Excellent side dish. Very tasty. I only had a small eggplant so I added mushrooms to stretch. Instead of fresh tomatoes I used a can of Italian tomatoes.
5704,3436,2001-02-12,4,"Variation, instead of vinegar use freshly squeezed lemon juice."
21267,3436,2001-12-05,5,"Very Good! This was my first try at it, and it came out great! It wasn't hard at all. Being raised in a half filipino family - it tastes very much like my mom's recipe! Next time, I'll cook it for my mom too and see what she thinks of it. =)

Note: Adobo is better with a sweet flavor, so I added brown sugar to mine as a variation and it worked out very well!"
